{
  "format": "ABL-PUBLICATION-MANIFEST-V1",
  "stage": "FOUNDING_SEASON",
  "ablReleaseCommit": "0694312a5e0cef3eb1834ad6c1e7ea1410178a2d",
  "launchStateDigest": "0xc3e89d8cb2d56446341716facad5e5ac33cad854793161c5313583d501df101c",
  "origins": {
    "publicApi": "https://6627f20ce31636e27d3a4ce8acadab83.us-was-1.preview.bl.run",
    "arena": "https://14b945aa3a75b7c5fb91ad2a8f7081df.us-was-1.preview.bl.run",
    "candidateIntake": "https://7beb90965130431fd744c003ccfeb7f5.us-was-1.preview.bl.run"
  },
  "files": [
    {
      "path": "README.md",
      "bytes": 3494,
      "mediaType": "text/markdown",
      "sha256": "0x6dddebb8885eefecae0f6b4d98ea4b1160980e7f12073b773813b8761fc7e996"
    },
    {
      "path": "TERMS.md",
      "bytes": 1014,
      "mediaType": "text/markdown",
      "sha256": "0x62ee271231c5e7c2430f2bdf00e6b968aa0142718327d547e5bd0589d3ba7bbf"
    },
    {
      "path": "THIRD_PARTY_NOTICES.md",
      "bytes": 23859,
      "mediaType": "text/markdown",
      "sha256": "0xe9b03c01a6999170aa40da205066db69bcb86ae7a5794760e7fa797e7e0e6dfa"
    },
    {
      "path": "docs/PARTICIPATION.md",
      "bytes": 6658,
      "mediaType": "text/markdown",
      "sha256": "0x4d0f0a2dc1e8c4fa4c679693cd5f40f59fc6a847bb7dc6cbaf7bad58128fb39d"
    },
    {
      "path": "docs/PROTOCOL.md",
      "bytes": 1464,
      "mediaType": "text/markdown",
      "sha256": "0x54fb5901b1cfeaa3cc1b7020951997ef3d7160aa325a9f44c03745c056e23b11"
    },
    {
      "path": "docs/architecture/VERIFIER_RULES.md",
      "bytes": 10778,
      "mediaType": "text/markdown",
      "sha256": "0xd60eca78854c182ee01083ac15106dec26893d34b4eac62fe01b0cf0a2e65ac1"
    },
    {
      "path": "docs/governance/DISCLOSURE_CONSTITUTION.md",
      "bytes": 4952,
      "mediaType": "text/markdown",
      "sha256": "0x36728706b6e1c7cbbfb75d44607b71cf872da18a1d570e1ca2047cb728361a6a"
    },
    {
      "path": "docs/governance/FOUNDING_CONSTITUTION.md",
      "bytes": 19228,
      "mediaType": "text/markdown",
      "sha256": "0x99ec89a3cb909d6e5507596a1a12625ebbe416365161f86d6af4c9a6ee42b4d6"
    },
    {
      "path": "skills/abl-league/SKILL.md",
      "bytes": 11394,
      "mediaType": "text/markdown",
      "sha256": "0x72b14ee4d3d83c7bbd1ddb086083d1bab217b89c3f91202879a26f359e20bec6"
    },
    {
      "path": "skills/abl-league/agents/openai.yaml",
      "bytes": 332,
      "mediaType": "application/yaml",
      "sha256": "0x8dd391cf2fbcaff0d4fb7e38bc1c90adfebc80685412e6c3b5199268dc4bf624"
    },
    {
      "path": "skills/abl-league/dist/abl-join.mjs",
      "bytes": 1142770,
      "mediaType": "text/javascript",
      "sha256": "0xff841843a98fd1fc7ca388fba0cf45e15cac476dd49511371fc95dad0fde7ec4"
    },
    {
      "path": "skills/abl-league/dist/abl-runner.mjs",
      "bytes": 1217913,
      "mediaType": "text/javascript",
      "sha256": "0x7184fce1a8d09b6ee19d59ab4e7269b17bb9127b65aabd3a6e981259d74bc7df"
    },
    {
      "path": "skills/abl-league/dist/manifest.json",
      "bytes": 191,
      "mediaType": "application/json",
      "sha256": "0x186dcb3d191f173fe7c9314de9fb7b0f2ffb1375d300dcce838220c6a55895f6"
    },
    {
      "path": "skills/abl-league/dist/runner-manifest.json",
      "bytes": 263,
      "mediaType": "application/json",
      "sha256": "0x63d3e5d29bc3aa6a23a563eba0f75bca0f0db68e3c899f2b52f74c5c26e47298"
    },
    {
      "path": "skills/abl-league/references/founding-join.md",
      "bytes": 9442,
      "mediaType": "text/markdown",
      "sha256": "0x10041903d21c5a8ff320cec07f5f5cf58f5059c6743cbfd845206f2dca99413e"
    },
    {
      "path": "verifier/abl-verifier.mjs",
      "bytes": 727915,
      "mediaType": "text/javascript",
      "sha256": "0x7cdb2100e3455a1ad9d33c04ddb63eb3a93b792251fbbf2b95b328efd6f44e15"
    },
    {
      "path": "verifier/schemas/event-packet.json",
      "bytes": 6756,
      "mediaType": "application/json",
      "sha256": "0xa50792890549e59ba065b589f484f0b06edf34fbc1d9555a5735400403248a7b"
    },
    {
      "path": "verifier/schemas/publication-manifest.json",
      "bytes": 3570,
      "mediaType": "application/json",
      "sha256": "0x5b99077224c418b4ee4d5c982f4520dd17dab628f15c518e315322333b5ae854"
    },
    {
      "path": "verifier/schemas/recognition-packet.json",
      "bytes": 852,
      "mediaType": "application/json",
      "sha256": "0x0c913e7942c40ae2c7cb8277f8d37662ccb879c0a67adc5237dc38ae944e1ecc"
    },
    {
      "path": "verifier/source/packages/basketball/src/attributes.ts",
      "bytes": 10906,
      "mediaType": "text/javascript",
      "sha256": "0xa13a36b9140750b6015827985d868628ff87c5c5a38f26602325b0a1641b15f5"
    },
    {
      "path": "verifier/source/packages/basketball/src/full-game.ts",
      "bytes": 26044,
      "mediaType": "text/javascript",
      "sha256": "0xc055e6da79f0ad90e70003fe0e0e2d675b78a563d8cad543833328f2102faa56"
    },
    {
      "path": "verifier/source/packages/basketball/src/game-finalization.ts",
      "bytes": 33178,
      "mediaType": "text/javascript",
      "sha256": "0x5af4d518fc17e708acec42e8c77cc078a75f5a42f86e7e3832b1a57f37357bb9"
    },
    {
      "path": "verifier/source/packages/basketball/src/types.ts",
      "bytes": 41231,
      "mediaType": "text/javascript",
      "sha256": "0xf7cadc2514831fb20c387b33d1835bf5dadd7ad18c544c16c11c8038d1660dd7"
    },
    {
      "path": "verifier/source/packages/recognition/src/base-checkpoints.ts",
      "bytes": 9489,
      "mediaType": "text/javascript",
      "sha256": "0xe07fad873d7c394e2e35edd9a0d249d1890c2f7678d6923a0ae09d36ef98f9e3"
    },
    {
      "path": "verifier/source/packages/recognition/src/canonical.ts",
      "bytes": 2404,
      "mediaType": "text/javascript",
      "sha256": "0x5936b6fb7984d5bee2e7269fd7fb7071e40261a89fe14f4e34158669386f9d9c"
    },
    {
      "path": "verifier/source/packages/recognition/src/checkpoint-witnesses.ts",
      "bytes": 7134,
      "mediaType": "text/javascript",
      "sha256": "0x492de6297116806a3e37ffe07dc665e4b5318c94f06f0defb3e58c23e8a631af"
    },
    {
      "path": "verifier/source/packages/recognition/src/checkpoints.ts",
      "bytes": 3545,
      "mediaType": "text/javascript",
      "sha256": "0x71f412152a5d19cc8ad0c58196b7e2d2f47fd136424f6958ee08336bea3e7460"
    },
    {
      "path": "verifier/source/packages/recognition/src/events.ts",
      "bytes": 3198,
      "mediaType": "text/javascript",
      "sha256": "0x5629c9459419de3f4bc294c282e030cd73c39470fa5164d66f1edf074b0cf6f6"
    },
    {
      "path": "verifier/source/packages/recognition/src/identity.ts",
      "bytes": 3012,
      "mediaType": "text/javascript",
      "sha256": "0x03e516989f89c38655137c21d405d7a735b2b0b301dd2d25951ca4b40906a24b"
    },
    {
      "path": "verifier/source/packages/recognition/src/merkle.ts",
      "bytes": 2187,
      "mediaType": "text/javascript",
      "sha256": "0xe923094a8c3871cb3edc5520516e549ee176b9ede91e1900de5769054b53c47d"
    },
    {
      "path": "verifier/source/packages/recognition/src/recognition-profiles.ts",
      "bytes": 9335,
      "mediaType": "text/javascript",
      "sha256": "0xe5438df769747c4c078204208e6540f4fa690069a6bae457f79311ac918825b7"
    },
    {
      "path": "verifier/source/packages/recognition/src/registry.ts",
      "bytes": 4025,
      "mediaType": "text/javascript",
      "sha256": "0x5e67999c086aa38748b7af9def181eff82bfe78423c599001afb72a12a3f213b"
    },
    {
      "path": "verifier/source/packages/recognition/src/verifier.ts",
      "bytes": 10463,
      "mediaType": "text/javascript",
      "sha256": "0x8d84ada7b91578cd843e5f0993fc3e35980642f9d2a710c7c13c16dd5f40c8a1"
    },
    {
      "path": "verifier/source/packages/schemas/src/index.ts",
      "bytes": 100735,
      "mediaType": "text/javascript",
      "sha256": "0x619afc04b87c995043058b3985a57c0c52ae748120068d7833cf86976dd4f74d"
    },
    {
      "path": "verifier/source/packages/schemas/src/publication-images.ts",
      "bytes": 1117,
      "mediaType": "text/javascript",
      "sha256": "0xd045bc5fca872f129193cbaaa62140d4e04347cc579ee1758a7019d8d01ed5c3"
    },
    {
      "path": "verifier/source/packages/schemas/src/publication.ts",
      "bytes": 2498,
      "mediaType": "text/javascript",
      "sha256": "0xaca7be141640e724fccf91965489aac2564c1e4983f812d7bd8f53f327e6720d"
    },
    {
      "path": "verifier/source/packages/storage/src/crypto.ts",
      "bytes": 5957,
      "mediaType": "text/javascript",
      "sha256": "0x90e84da9a4d5c80a52bcb16b0dfdc0a5214b4453d0deeb4343275895c376b504"
    },
    {
      "path": "verifier/source/public-artifacts/verifier/cli.ts",
      "bytes": 3868,
      "mediaType": "text/javascript",
      "sha256": "0xb04b32f82113da2230537304b8ca73e39d146866ec62d9506fb895e8c23e0585"
    },
    {
      "path": "verifier/source/public-artifacts/verifier/manifest.ts",
      "bytes": 5412,
      "mediaType": "text/javascript",
      "sha256": "0x0155e684f853404727f87d28b26b36e708312b1b1d324ce13f541f7232665bcc"
    },
    {
      "path": "verifier/source/public-artifacts/verifier/recognition.ts",
      "bytes": 365,
      "mediaType": "text/javascript",
      "sha256": "0xbfb0069378e016aae18a358275f75823e44544e4a61691551a382bc7c4a57e17"
    },
    {
      "path": "verifier/source/public-artifacts/verifier/verification.ts",
      "bytes": 8445,
      "mediaType": "text/javascript",
      "sha256": "0x0fedc02fc978ba37ce1cbd128edfb2e4f95f876a3a338b4696677f9438dc0018"
    },
    {
      "path": "verifier/test-vectors.json",
      "bytes": 7009,
      "mediaType": "application/json",
      "sha256": "0x618053ad5aec70534b143a30581d3a8ec7e8d4f03254b31ea1294fb9ce8f0dd9"
    }
  ],
  "publicImages": [
    {
      "name": "public-api",
      "provider": "BLAXEL",
      "imageReference": "sandbox/abl-stage-c-public-api-image:bf5a97f58c96297bcf6ea",
      "buildContextSha256": "0x42731eb3d09ac1e473a937935cf5d44855d1cacbfa4344d3a46ef35de34d251c"
    },
    {
      "name": "arena",